,ID,link,country,time_id,recommend,value,fun,reviews,game,date,total_time,review_time
478,76561198080963521,https://steamcommunity.com/profiles/76561198080963521/recommended/,Other,6,Recommended,39,3,"This game is very short (20-25 minutes) and so incredibly bizarre. At first, nothing makes sense in The Good Time Garden, but as you progress, you might find yourself reflecting on fundamental life-issues, philosophy, spirituality, metaphysics, long lost memories and Existence itself.You're playing in a garden where breasts are growing like plants, you slap them and they instantly give birth to baby boobs right in front of you.You're playing in a garden where a huge four-eyed butt is staring at you, waiting for you to slap it a couple of times.You're playing in a garden where baby butts joyfully follow you around.You're playing in a garden where you have to keep feeding a fat, hungry lump of flesh.At the end of the game, I believe that you open the door to enlightenment. The secrets of the Universe are finally revealed.This game is a surreal, hilarious hand-drawn masterpiece.CONTROLSYou won't find a MENU nor any information on how to control your little character, so I'll leave this here:⦁ Movement - WASD keys⦁ Slap - SPACEBAR⦁ Water - N⦁ Pick Up/Drop/Feed - M								",https://steamcommunity.com/app/1200860,10 March,1.2,1.2
479,76561198080963521,https://steamcommunity.com/profiles/76561198080963521/recommended/,Other,5,Recommended,108,0,"I would say that Virtual Cottage is more of an app than a game, and a really GREAT one to have! You just let it run in the background and go read/study, get some tasks done or just relax and daydream.𝐈𝐓 𝐎𝐅𝐅𝐄𝐑𝐒 𝐘𝐎𝐔 :⦁ A To-Do List⦁ A Timer⦁ Daylight changes in real time⦁ Soothing atmospheric sounds (like wind, raindrops, snow, fireplace, and of course you can adjust how loud they play)⦁ An AMAZING music library (probably one of the best lo-fi playlists I've heard in a long time)⦁ Pets in your little cottage (you can choose a cat or a dog to keep you company)The bottom line is, I highly recommend this great app! Besides, it's free, so why not give it a try?								",https://steamcommunity.com/app/1369320,6 March,114.2,1.3
480,76561198080963521,https://steamcommunity.com/profiles/76561198080963521/recommended/,Other,4,Recommended,39,1,"I really enjoyed this game, I would say that is both lovely and sad. It's a short story about mental illness, choices and friendship. One of the endings (the positive one) actually made me drop a tear.. for the character, for myself, for all the people out there who are afraid to share what is truly happening inside their hearts.10/10 really nice artwork.10/10 relaxing background music.10/10 recommend it.								",https://steamcommunity.com/app/812810,6 March,3.5,3.5
481,76561198080963521,https://steamcommunity.com/profiles/76561198080963521/recommended/,Other,3,Recommended,62,2,"After playing this game for a few hours, I'm really trying to understand why it has so many negative reviews. I see that a lot of people complain about the ""one unit move per turn"" mechanic, but to be honest, that's what makes this game challenging. It determines you to really plan your strategy and think twice about your next move, not just go commando style heads forward into battle. In my opinion, this feature should definitely be considered a plus to the game. Also, I like the constant struggle of keeping your squad alive, because once your men are killed, they stay dead and you need to spend a lot of hard earned cash to recruit new ones and upgrade their skills from scratch. This is also part of the challenge to use your head and tactics instead of jumping from tile to tile and randomly pressing buttons. Overall, I'm really enjoying this game and would recommend it to anyone who's a fan of turn-based strategy games, and of course, of the Netflix show.  GAMEPLAY ⦁ Interactive turn-based system⦁ Features two campaigns, switch between Narcos and the DEA⦁ Variety of units with special skills⦁ Story-driven prologue⦁ Good graphics⦁ Good mechanics								",https://steamcommunity.com/app/914110,6 March,44.6,3.1
482,76561198080963521,https://steamcommunity.com/profiles/76561198080963521/recommended/,Other,2,Recommended,51,4,"Armello takes a new look at the digital fantasy board game. It incorporates RPG elements, card games, strategy games, turn‑based combat, and dungeon grinding. The character art is reminiscent of Disney’s animated Robin Hood, with the weapon-baring animals conjuring the same nostalgia. It’s a fantastic aesthetic that adds a lot of personality, charm and uniqueness to the digital board game. Furthermore, an enchanting soundtrack does a great job of portraying the medieval setting.The combat is a mixture of random dice rolls, character stats, and any cards you have in your possession that you’re willing to play. It’s an ideal balance of luck and tactics.With the adventuring, the medieval fantasy setting and the fight for the throne, Armello invokes ""Game of Thrones"", ""Magic the Gathering"" and ""Risk"", and delivers precisely the kind of experience you’d expect from such a combination. The acts of cruelty you can perform are devious, the adventuring bold and heroic, and the twists as you flit between victory condition paths unforeseeable and sudden. It’s a great drama to witness and play. GAMEPLAY ⦁ Variety of heroes with unique abilities⦁ Hex tile design⦁ Day/Night cycle⦁ Huge replayability⦁ Four victory option⦁ Interactive turn-based system⦁ Cards⦁ Story-driven prologue⦁ Fair multiplayer ⦁ Luck and random number generator								",https://steamcommunity.com/app/290340,6 March,512.0,123.4
483,76561198080963521,https://steamcommunity.com/profiles/76561198080963521/recommended/,Other,1,Recommended,11,0,"You just can't say ""no"" to The Black Watchmen. This game is so incredibly unique, by far the best ARG. GAMEPLAY ⦁ Interacting with real websites⦁ Sending and receiving e-mails/phone calls⦁ Doing a lot of wikipedia research⦁ Working with weird case files and locations⦁ Connecting with other people and working together on assignments⦁ Live events								",https://steamcommunity.com/app/349220,6 March,197.7,8.2
484,76561198066396234,https://steamcommunity.com/profiles/76561198066396234/recommended/,Other,4,Recommended,53,104,"I'm a simple man. I saw boobs, added it to cart, then proceeded to check out.Had a lot of random scam/spam add before purchased this, then after I put reviews of Sakura games on my page, no one added me anymore, even some friends deleted me.69/100 ( ͡° ͜ʖ ͡°)								",https://steamcommunity.com/app/342380,"14 June, 2015",9.9,9.9
485,76561198066396234,https://steamcommunity.com/profiles/76561198066396234/recommended/,Other,3,Recommended,96,245,"Had almost no friends before purchased this game, no longer need friends after playing this game69/10 - would recommend								",https://steamcommunity.com/app/375200,"12 June, 2015",9.9,9.9
486,76561198066396234,https://steamcommunity.com/profiles/76561198066396234/recommended/,Other,2,Recommended,77,198,"A touching game, well at least I touched myself ( ͡° ͜ʖ ͡°)69/10								",https://steamcommunity.com/app/313740,"12 June, 2015",10.1,10.0
487,76561198066396234,https://steamcommunity.com/profiles/76561198066396234/recommended/,Other,1,Recommended,3,0,Tagalog and Russian dictionaries are included in this game.								,https://steamcommunity.com/app/570,"12 November, 2014",555.0,555.0
488,76561198092724413,https://steamcommunity.com/profiles/76561198092724413/recommended/,Other,10,Recommended,0,0,"Geiles Spiel wie der Vorgänger, nur leider noch weniger Rätsel, weniger Aufgaben, schneller Durchlauf der Story. Ich glaub hier wollte man einfach schnell was hinter herschieben nach dem 2. Teil um die Verkaufszahlen hoch zu halten und die Gewinne zu maximieren. Sehr schade, aber trotzdem ein nettes Spiel! Hab es umsonst bekommen bei der AMD RX Aktion :)								",https://steamcommunity.com/app/952060,"13 June, 2020",8.1,8.1
489,76561198092724413,https://steamcommunity.com/profiles/76561198092724413/recommended/,Other,9,Recommended,0,0,"Geiles Game :) Städte zum erkunden / looten wären nice, dann wäre nicht so viel unkontrolliertes PVP. Ansonsten Toooooppppp								",https://steamcommunity.com/app/252490,"16 December, 2019",319.5,81.1
490,76561198092724413,https://steamcommunity.com/profiles/76561198092724413/recommended/,Other,8,Recommended,5,0,"Super dichtes, atmosphärisches Spiel. Ich liebe sowieso die Kulisse - daher hatte das Spiel einige Pluspunkte bei mir. Viele negative Reviews erwähnen den fehlenden Horror-Aspekt. Dem stimme ich zu, es ist wirklich außer der grandiosen Atmo sehr wenig Horror im Spiel, man erschreckt sich eigentlich nie. Dafür ist die Story aber rundum gut erzählt, es wird nie langweilig durch diesen schönen Wald zu wandern und einmal kann man das Spiel aufjedenfall durchzocken. Ich wollte bis zum Ende wissen wo der Sohn dieser Mutter ist und es wurde durch Hinweise, kleine Rätsel auch nie langweilig. Bisher auch in der Form noch kein Spiel entdeckt und daher ist das eins, das ich weiterempfehlen würde! Es muss nicht immer nur offensichtlicher Horror sein, es geht auch anders, leider passt das einigen nicht was man irgendwie nachvollziehen kann, es ist kein Resident Evil und kein Outlast - das steht fest! Dennoch gelungen und eine kleine Indie-Horror Perle für zwischendurch. Wenn man sich auf das Spiel und die Story einlassen kann, nicht zu hohe Erwartungen an den Horror-Aspekt hat, wird sein Spaß bei dem Spiel haben. Für das volle Erlebnis, unbedingt in der Nacht mit Kopfhörern zocken.								",https://steamcommunity.com/app/368430,"3 January, 2019",6.5,6.5
491,76561198092724413,https://steamcommunity.com/profiles/76561198092724413/recommended/,Other,7,Recommended,4,0,"Sehr geiles Horrorspiel. Atmosphäre, Grafik und Aufbau der Story ist wirklich sehr gut durchdacht und sehr schön umgesetzt. Ich habe das Ende etwas zu bemängeln, es sollte / musste natürlich Tempo aufgebaut werden und schneller werden um es zum spannenden Finale zu führen, aber der Kampf mit ****** war sehr kurz und zu schnell vorbei. Ich konnte kaum mein Arsenal an Munition verballern und die ganze gesparte Munition einsetzen, da hätte man einen coolen, längeren Endboss-Kampf draus machen können mit verschiedenen Angriffsmethoden, vielleicht sogar mit anschließender Verwandlung in ein großes Monster um es danach geschwächt dann die Injektion zu verabreichen, dass hätte das Spiel wohl perfekt gemacht und ich würde das Spiel überall mit 10/10 bewerten. Aber so ist es leider ""nur"" eine 8/10 und es hat  trotzdem wirklich richtig viel Spaß gemacht & extrem gefesselt. Ich bin froh das sich die Entwickler mal neu ausprobiert haben, da Resi 5+6 ja mit der Spielmethode immer mehr abgeflacht und stumpf geworden sind. Das Erlebnis wurde immer weniger nachhaltig, spaßig und unnovativ. Hiermit haben sie sich wohl selbst übertroffen und sowas soll erst mal ein Horrorspiel-Entwickler nachmachen, Hut ab! Oulast 2 ist ja leider durch flache, schlecht umgesetzte Story untergegangen aber Resi 7 ist wirklich großartig. Ein muss für jeden Horror-Survival Fan!								",https://steamcommunity.com/app/418370,"1 January, 2019",14.9,14.9
492,76561198092724413,https://steamcommunity.com/profiles/76561198092724413/recommended/,Other,6,Recommended,0,0,"Das ist definitiv das beste Horror-Survival-Story Game das ich je gespielt habe. Survival zieht sich durch die ganze Story, es gibt kaum Momente in denen der Körper nicht vor Angst gezittert hat. Ich hatte noch nie so ein bedrückendes, angsteinflößendes Gefühl bei einem Horrorspiel gefühlt. Außer Outlast hat dies bisher noch kein einziges Spiel geschafft! Dadurch das die Bedrohung meistens um einen herum ist und nicht vor einem, hört das auch nie auf. Das ganze gepaart mit super tollen, interessanten Rätseln und einer packenden Story erschafft es das wohl beste Alien Spiel aller Zeiten. Ich habe die gesamte Spielzeit gestaunt und das Finale war so unheimlich gruselig und packend, bei meinen Top 3 teilt sich dieses Spiel den 1. Platz mit Outlast und Amnesia.								",https://steamcommunity.com/app/214490,"31 December, 2018",18.1,18.1
493,76561198092724413,https://steamcommunity.com/profiles/76561198092724413/recommended/,Other,5,Not Recommended,2,0,Richtiger Rotz !! Das ist ein Spiel für alle die TRASH GAMES lieben!!								,https://steamcommunity.com/app/337950,"31 May, 2018",0.5,0.5
494,76561198092724413,https://steamcommunity.com/profiles/76561198092724413/recommended/,Other,4,Recommended,1,0,"Ich liebe dieses Spiel - Einfach eine extrem gute Abwechslung nach 300std Dead By Daylight... Da in DbD als Survivor zu Spielen für mich kaum einen Reiz mehr hat, da man kaum Interaktion mit anderen Überlebenden haben kann, außer man spielt mit seinen Freunden. Das fehlt mir sehr dort und The Deceit bringt das Feature zurück und das auch noch Kostenlos! Es lebt einfach von witzigen Gesprächen, Manipulation, auffälligen Aktionen... Und vieeel Atmosphäre & schöner Grafik. Es macht tierisch Spaß, es ist perfekt für Anfänger geeignet und für Horror-Fans ein MUSS! Ein Spiel das durch die viele, witzige Interaktion mit fremden Leuten auch ohne seine eigenen Freunde extrem viel Spaß macht.								",https://steamcommunity.com/app/466240,"31 December, 2018",282.7,140.8
495,76561198092724413,https://steamcommunity.com/profiles/76561198092724413/recommended/,Other,3,Not Recommended,2,0,"DAS SPIEL IST GENAUSO SCHEIßE WIE ALLE ANDEREN LETZTEN TEILE ZUVOR AUCH!- Die Animationen 1:1 Übernommen genau wie die schlechte Engine. Grafik ist wie von 2013.- Mini Maps- Man kriegt kaum nh Übersicht weil direkt 5 Gegner vor dir quer durch laufen. Und alles viel zu schnell geht.- Einfach dumm drauf ballern reicht vollkommen aus.- Die Runden sind so kurz, ich seile länger einen ab als wie die Runden hier dauern.3 Jahre lang daran gearbeitet? Ach du Scheiße. Absolute Enttäuschung, Gottseidank gab es die kostenlose Beta um vorgewarnt zu sein.								",https://steamcommunity.com/app/696790,"30 September, 2017",0.9,0.9
496,76561198092724413,https://steamcommunity.com/profiles/76561198092724413/recommended/,Other,2,Recommended,0,0,"Ganz klar - das Zombie-Survival Spiel mit dem größten Potenzial! Miscreated wurde mitlerweile released, so wie man das mitbekommen hat? Meine gesamte Spielzeit beläuft sich auf die Alpha Version und den Verlauf zwischen den Jahren. Ich habe lange gedacht das sich bei Miscreated nicht viel tun wird. Es hat als grandioses Early-Access angefangen und sich stetig weiterentwickelt. Die Map wurde erweitert, die Fahrzeuge wurden verdreifacht. Animationen sind viele vorhanden, das Spielgefühl ähnelt sehr dem Vorreiter DayZ. Für mich ist aber Miscreated definitiv gelungen, es hat sich viel verändert, die Entwickler legen viel Wert auf ein realistisches Spiel. Es gibt viele Funktionen (Hunger,Durst, Radioaktivität, Lebensmittelvergiftung, etc..) die das Spiel wirklich interessant machen. Außerdem die Möglichkeit verschiedene Tiere zu Jagen und zu verspeisen. Die Grafik ist mit Abstand die beste die es je bei einem Zombie-Survival Spiel das in der Open-World spielt, gegeben hat. Dies trägt sehr zur Amtosphäre bei die wirklich unangefochten gelungen ist. Das Spiel hat mittlerweile ein fortschrittliches Base-Building System, dass mit Rezepten erweitert werden kann. Einzig allein was ich umständlich und blöd geregelt finde, ist das Metall-Basebuilding. Die Teile müssen gefunden und mit einem Fahrzeug weggezogen werden. Es gibt Metallschrott im Spiel, der sich super zum craften eignen würde, leider war es den Entwicklern doch wohl zu viel Arbeit da eine dringende Lösung definitiv notwendig war, bei den ganzenm Dieben, Plünderern die einem jeden Tag die Holz-Base aufgebrochen haben. Im Jetzigen Zustand ist das Spiel einfach super, man kann auch Anbauen (Gärtnerei - Gemüse) und es hat sich wirklich sehr gut entwickelt. Leider könnte die Map größer sein, meiner Meinung nach noch zu klein für ein dauerhaftes spaßiges Spielerlebnis. Obwohl die Map in anderen Spielen (zB. wie Infestation) auch in nicht allzu großer Größe wunderbar funktioniert hat. Das lag dort aber wahrscheinlich am vereinfachten PVP - der nie langweilig wird. Es gibt ein extrem vielfältiges Wettersystem (Sandsturm, Radioaktiver Sturm, Schnee, Sonnenschein-Regen,..) der wirklich sehr schön umgesetzt wurde. Ich bin gespannt was noch dazu kommt und bin bisher wirklich zufrieden, leider gibt es immer mehr Flops in der Richtung, weshalb Miscreated schon eine kleine Bereicherung ist.								",https://steamcommunity.com/app/299740,"31 December, 2018",228.8,223.5
497,76561198092724413,https://steamcommunity.com/profiles/76561198092724413/recommended/,Other,1,Recommended,0,0,"Ein Spiel das mit viel Liebe gemacht wurde! Es macht wahnnsinig Spaß sich seine eigene Base aufzubauen und die Welten zu erkunden. Es bietet so viele Möglichkeiten und Abwechslung wie manch fertige Spiele nicht! Ich kann kaum glauben das es eine Pre-Alpha ist. Ich liebe dieses Spiel, diese magische Atmosphäre und der malerische Grafikstil mit hübschen Farben und schönen Kontrasten, ich hoffe das die Entwickler daraus einen richtigen Diamanten machen werden! Es steckt sooooooviel Potenzial drinnen, ich bin mir sicher das wird ein grandioses Spiel & ist jetzt schon einer meiner absoluten Lieblingsspiele aus dem Jahr 2016! Wie ein kleines ""Happy End"" für das letzte Jahr, Danke ""System Era Softworks"" für dieses wunderschöne Weltraumspiel! Das einzige was ich leider bemängeln muss... Ich hab im Spiel mit weitester Sichtentfernung ca. 60 Fps gehabt, mittlerweile (da man viel gebaut hat) muss ich auf kurzer Distanzsichtung bei ca. 25-35 Fps spielen...Trotzdem klare Klare Kaufempfehlung, wer Weltraumspiele mag sollte nicht lange überlegen, sofort zugreifen!								",https://steamcommunity.com/app/361420,"31 December, 2018",22.7,22.7
498,76561198027194837,https://steamcommunity.com/profiles/76561198027194837/recommended/,Other,10,Recommended,2,0,Watermelon is my favorite weapon! favorite pet Frog! favorite teacher Madame Pudding! favorite item Bongo!								,https://steamcommunity.com/app/1862840,10 August,3.5,2.0
499,76561198027194837,https://steamcommunity.com/profiles/76561198027194837/recommended/,Other,9,Recommended,1,1,Yo this game is prehistorical?								,https://steamcommunity.com/app/216090,5 August,3.2,3.2
500,76561198027194837,https://steamcommunity.com/profiles/76561198027194837/recommended/,Other,8,Recommended,1,0,This is my Favorite Animal!								,https://steamcommunity.com/app/1986230,30 July,0.1,0.1
501,76561198027194837,https://steamcommunity.com/profiles/76561198027194837/recommended/,Other,7,Recommended,13,0,All the fruit and vegetables have their own quirky dialogue. Beautiful game with several items to bounce between. It taught me the meaning of having mafia blood and how to wield a weapon without hands. The soundtrack is also amazing by James Currier.  Taxation with Representation!								,https://steamcommunity.com/app/1205450,17 July,5.3,4.8
502,76561198027194837,https://steamcommunity.com/profiles/76561198027194837/recommended/,Other,6,Recommended,12,0,"Easy Peasy Lemon Squeezy 100% I challenge you to do the same. It's part of a humble bundle 12 days left from the time I am writing this review. OG SUmmer Break Game bundle https://www.humblebundle.com/games/outright-games-summer-break?hmb_source=&hmb_medium=product_tile&hmb_campaign=mosaic_section_1_layout_index_1_layout_type_threes_tile_index_2_c_outrightgamessummerbreak_bundle or you can purchase it on sale. Cutely drawn cartoon animals, reminds me of my childhood with Disney lol.								",https://steamcommunity.com/app/1635590,17 July,3.9,0.9
503,76561198027194837,https://steamcommunity.com/profiles/76561198027194837/recommended/,Other,5,Recommended,3,0,"The cats are so tiny, had to use the guide for any missing ones. Calm and peace full game.								",https://steamcommunity.com/app/1969080,10 July,2.0,0.3
504,76561198027194837,https://steamcommunity.com/profiles/76561198027194837/recommended/,Other,4,Recommended,3,0,https://youtu.be/3wcKr12EvH4 ,https://steamcommunity.com/app/325150,8 July,20.6,20.6
505,76561198027194837,https://steamcommunity.com/profiles/76561198027194837/recommended/,Other,3,Recommended,5,0,"Pleasant soundtrack, walking simulator. I got lost at the end, but managed to find my car. Also for the miss able achievement lost body, it's behind the tent where the camper asks you to find his backpack.								",https://steamcommunity.com/app/1805590,8 July,2.2,2.2
506,76561198027194837,https://steamcommunity.com/profiles/76561198027194837/recommended/,Other,2,Recommended,8,1,The sex scenes were memorable and it was interesting to play through each girl's route. The only thing is the screenshot button didn't work. Would play again for a great time! These girls were so much fun to date<3P.S: Favorite girl is Lilly								,https://steamcommunity.com/app/1173400,8 August,1.0,1.0
507,76561198027194837,https://steamcommunity.com/profiles/76561198027194837/recommended/,Other,1,Recommended,6,0,Fun fighting game!								,https://steamcommunity.com/app/449210,"25 August, 2021",3.1,3.1
508,76561198119441306,https://steamcommunity.com/profiles/76561198119441306/recommended/,United States,3,Recommended,1,0,Worth the time to read. Sometimes a bit wordy but otherwise a good read								,https://steamcommunity.com/app/463390,"24 July, 2019",9.8,7.5
509,76561198119441306,https://steamcommunity.com/profiles/76561198119441306/recommended/,United States,2,Recommended,0,0,Good game with high skill ceiling. Graphics and customization abilities are fun. Maps are limited and unbalanced in some cases but over all it is a great game.								,https://steamcommunity.com/app/629760,"2 July, 2019",168.4,28.1
510,76561198119441306,https://steamcommunity.com/profiles/76561198119441306/recommended/,United States,1,Recommended,0,0,"Fun game, though you have to be careful of the more toxic players								",https://steamcommunity.com/app/730,"4 February, 2017",543.9,315.8
511,76561198065839244,https://steamcommunity.com/profiles/76561198065839244/recommended/,Other,3,Not Recommended,0,0,Koop Kaputt :C sonst echt witzig.								,https://steamcommunity.com/app/206420,29 March,3.8,3.7
512,76561198065839244,https://steamcommunity.com/profiles/76561198065839244/recommended/,Other,2,Recommended,1,0,"One single word: ""MORE""								",https://steamcommunity.com/app/455820,"16 May, 2018",6.2,6.2
513,76561198065839244,https://steamcommunity.com/profiles/76561198065839244/recommended/,Other,1,Recommended,1,0,wow								,https://steamcommunity.com/app/439190,"15 May, 2018",10.7,4.9
514,76561198089669561,https://steamcommunity.com/profiles/76561198089669561/recommended/,Other,3,Recommended,0,0,Great game!								,https://steamcommunity.com/app/745920,"26 November, 2020",84.9,60.9
515,76561198089669561,https://steamcommunity.com/profiles/76561198089669561/recommended/,Other,2,Recommended,0,0,Mega Knorke!								,https://steamcommunity.com/app/431960,"14 January, 2020",342.5,118.7
516,76561198089669561,https://steamcommunity.com/profiles/76561198089669561/recommended/,Other,1,Recommended,0,1,Nice								,https://steamcommunity.com/app/570,"3 December, 2019",220.2,220.2
517,76561198026550702,https://steamcommunity.com/profiles/76561198026550702/recommended/,Other,5,Recommended,0,0,Good experience.								,https://steamcommunity.com/app/239140,"25 May, 2018",8.3,8.2
518,76561198026550702,https://steamcommunity.com/profiles/76561198026550702/recommended/,Other,4,Recommended,0,0,Tons of options to have fun with.								,https://steamcommunity.com/app/4000,"25 May, 2018",23.1,21.0
519,76561198026550702,https://steamcommunity.com/profiles/76561198026550702/recommended/,Other,3,Not Recommended,0,0,Awful optimization.								,https://steamcommunity.com/app/474960,"25 May, 2018",0.4,0.4
520,76561198026550702,https://steamcommunity.com/profiles/76561198026550702/recommended/,Other,2,Recommended,0,0,"Great game overall, it's fun.It took me about 8 hours to reach endgame but of course there are other difficulities you could try for a bigger game time.Would advise.								",https://steamcommunity.com/app/341000,"25 May, 2018",10.3,5.2
521,76561198026550702,https://steamcommunity.com/profiles/76561198026550702/recommended/,Other,1,Recommended,0,0,Love it!								,https://steamcommunity.com/app/504370,"31 May, 2017",126.0,16.3
