,ID,link,country,time_id,recommend,value,fun,reviews,game,date,total_time,review_time
249,76561198282034238,https://steamcommunity.com/profiles/76561198282034238/recommended/,Other,7,Recommended,11,1,"Muito Top, é um Grand Theft Auto de Escola kkkk								",https://steamcommunity.com/app/12200,"25 October, 2021",1.7,1.5
250,76561198282034238,https://steamcommunity.com/profiles/76561198282034238/recommended/,Other,6,Recommended,5,0,Muito Bom!								,https://steamcommunity.com/app/242700,"11 October, 2021",8.1,3.6
251,76561198282034238,https://steamcommunity.com/profiles/76561198282034238/recommended/,Other,5,Not Recommended,2,0,Ridículo								,https://steamcommunity.com/app/1665460,"4 October, 2021",5.5,1.5
252,76561198282034238,https://steamcommunity.com/profiles/76561198282034238/recommended/,Other,4,Recommended,6,1,O melhor GTA da época do Playstation 2!								,https://steamcommunity.com/app/12120,"9 September, 2021",26.0,8.9
253,76561198282034238,https://steamcommunity.com/profiles/76561198282034238/recommended/,Other,3,Recommended,4,1,Muito Bom!								,https://steamcommunity.com/app/287290,"20 July, 2021",8.2,7.8
254,76561198282034238,https://steamcommunity.com/profiles/76561198282034238/recommended/,Other,2,Recommended,8,0,Muito Top!								,https://steamcommunity.com/app/418370,"29 June, 2021",35.4,13.3
255,76561198282034238,https://steamcommunity.com/profiles/76561198282034238/recommended/,Other,1,Recommended,6,0,"Top demais, Joguei muito no Nitendo 64								",https://steamcommunity.com/app/405830,"26 June, 2021",2.3,2.3
256,76561198276524986,https://steamcommunity.com/profiles/76561198276524986/recommended/,Other,4,Recommended,0,0,Aim								,https://steamcommunity.com/app/824270,23 June,25.2,25.2
257,76561198276524986,https://steamcommunity.com/profiles/76561198276524986/recommended/,Other,3,Recommended,0,0,Um bom aim trainer!								,https://steamcommunity.com/app/714010,"18 September, 2020",37.1,18.8
258,76561198276524986,https://steamcommunity.com/profiles/76561198276524986/recommended/,Other,2,Recommended,0,0,"Ótimo jogo, com muitos bosses e diversas modalidades de jogo. Recomendo Muito!Aguardando a 1.4.								",https://steamcommunity.com/app/105600,"28 April, 2020",369.4,190.6
259,76561198276524986,https://steamcommunity.com/profiles/76561198276524986/recommended/,Other,1,Recommended,0,0,muito bom								,https://steamcommunity.com/app/301640,"3 July, 2019",5.0,3.0
260,76561198086130264,https://steamcommunity.com/profiles/76561198086130264/recommended/,Other,10,Not Recommended,12,2,"Слабая, посредственная игра.Сюжета толком и нет. Боёвка медленная, местами кривая. Перс медленный. Основные фишки соулс игр были убраны (перекат при выделении цели, стамина при ударах, не видно на основном экране сколько ещё опыта до уровня). Геймплей очень тягомотный. Финал вообще расстроил. Не увидел связи по сюжету, чем эта игра является приквелом (но может из-за того что не играл в Ремнант).Игра на один раз. Но цена слишком высока для этого. Не рекомендую брать сейчас. Лучше дождаться скидки в 80%.								",https://steamcommunity.com/app/967390,"6 December, 2020",8.3,8.3
261,76561198086130264,https://steamcommunity.com/profiles/76561198086130264/recommended/,Other,9,Recommended,2,0,"Отличный сюжет. Хорошая игра. Но есть технические огрехи. Нет озвучки. Некоторый текст на английском. Но если на всё это закрыть глаза, то игра очень шикарна. Для любителей детективов рекомендую к прохождению.								",https://steamcommunity.com/app/1003890,"27 November, 2019",12.1,12.1
262,76561198086130264,https://steamcommunity.com/profiles/76561198086130264/recommended/,Other,8,Recommended,4,0,"Напишу своё мнение по игре.Правда особо много не напишешь, так как контента очень мало. Просто катастрофически мало для оценки.Начну с плюсов.1. Задумка хорошая, но истории и сюжета пока очень мало. Но пройдя обучение и посмотрев трейлеры, хочется узнать больше про героиню, катастрофу и мир.2. Порадовал голос в голове героини. Респект ;)3. Графика для инди игры не фантастическая, но для такой цены игры вполне норм.Минусы, куда же без них ;)1. Это управление. Сделано оно из рук вон плохо. Поворачивать камеру зажав правую кнопку мыши, вы СЕРЬЁЗНО. Это что стратегия?!2. Таргет на цель так у меня и не выбрался. Я не могу пометить врага и стрелять по нему прицельно. Мне обязательно нужно крутить камеру, каждый раз.3. Курсор (или метку) нужно делать намного ярче, чтобы его было видно очень хорошо. Потому что вращая камеру на фоне игры очень легко потерять его из виду и потом ищи пол часа куда он делся.4. Также написали что выпустили патч и лекарства стали появляться чаще?! Ну и где они. За полчаса игры на выживание так и ни разу не нашёл ни одного шприца. В итоге смерть от полученных ранений.Подведём итог.Потенциал игры хороший и надеюсь разработчики будут улучшать её. Чаще будут пополнять контент игры. И подумают над переделкой управления, либо добавят управление через геймпад.								",https://steamcommunity.com/app/1013410,"14 March, 2019",0.6,0.6
263,76561198086130264,https://steamcommunity.com/profiles/76561198086130264/recommended/,Other,7,Recommended,5,0,Очень классная экономическая стратегия про паровозики. Игра не даёт скучать и всё время затягивает. Рекомендую к покупке. Не пожалеите.								,https://steamcommunity.com/app/503940,"21 November, 2018",219.1,118.0
264,76561198086130264,https://steamcommunity.com/profiles/76561198086130264/recommended/,Other,6,Recommended,43,2,А почему ролики без субтитров???								,https://steamcommunity.com/app/323190,"24 April, 2018",65.1,14.2
265,76561198086130264,https://steamcommunity.com/profiles/76561198086130264/recommended/,Other,5,Recommended,5,0,"Отлично. Проблему с видеоролика пофиксили. Теперь можно и рекомендовать игру к покупке !!! ""ОЧЕНЬ СЫРОЙ ПРОДУКТ. Не рекомендую. Играть не возможно. Постоянно зависает. Даже сложно запустить деспетчер задач, чтобы отключить. Комп тормозить по страшному. Надеюсь с патчем всё исправят. Но сейчас таких денег игра не стоит. Вопрос к разработичкам. Вы хотябы её тестировали???? Игра зависает почти всегда, как только начинатеся видеоролик. Либо после смерти героя.""								",https://steamcommunity.com/app/471010,"1 December, 2017",1.6,1.6
266,76561198086130264,https://steamcommunity.com/profiles/76561198086130264/recommended/,Other,4,Not Recommended,64,2,"Задумка хорошая. Реализация говно.Управление через клавиатуру работает через раз. Очень долгие загрузки. Игра вылетает. Не всегда работает на геймпаде. Выбрать мелкий предмет для того чтобы его обыскать (глиняный горшок, стул) очень затруднительно, т.к. персанаж его просто оббегает и не наводится. После 2 часов игры один сплошной негатив. На данный момент игра своих денег не оправдала. Нужно ждать просто огромадного патча, чтобы всё это исправили. Вопрос только когда он будет? Лучше бы ещё перенесли выход игры на месяц, чем выпускать сырой продукт. ПОКА НЕ РЕКОМЕНДУЮ.								",https://steamcommunity.com/app/468000,"22 May, 2017",24.6,9.2
267,76561198086130264,https://steamcommunity.com/profiles/76561198086130264/recommended/,Other,3,Recommended,0,0,"Очень интресная, сложная и увлекательная игра с великолепным сюжетом и замечательной музыкой. Игра в которую хочется играть и играть до победного момента, так как финал этого стоит. Советую всем в неё поиграть и пройти до конца. Игра СУПЕР!!!								",https://steamcommunity.com/app/261570,"23 November, 2017",31.8,31.8
268,76561198086130264,https://steamcommunity.com/profiles/76561198086130264/recommended/,Other,2,Not Recommended,35,1,ГДЕ РУССКИЙ ИНТЕРФЕЙС И  СУБТИТРЫ ((((((								,https://steamcommunity.com/app/208650,"27 November, 2019",50.7,8.4
269,76561198086130264,https://steamcommunity.com/profiles/76561198086130264/recommended/,Other,1,Recommended,0,0,Игра просто потрясающая. Сюжет трогает до слез. Независимо от того что это квест и загадки были простыми эту игру нельзя не дооценивать. Советую всем её пройти.								,https://steamcommunity.com/app/260230,"7 August, 2014",24.6,19.7
270,76561198032500682,https://steamcommunity.com/profiles/76561198032500682/recommended/,Other,10,Recommended,53,3,"The pain I will endure is nothing compared to their suffering.I'm a sucker for the metroidvania genre, giving me a bare minimum of those distinguishing features is usually enough to get me to enjoy a game. And Ender Lilies delivers all those features I enjoy, in all it's true metroidvania fashion and aptitudes like dodge, double jump, ground slam, hook, sealed doors and areas, only accessible after unlocking the required skill. A huge map that's fun to explore, and lets you find new abilities to open previous inaccessible areas, while leveling up and upgrading your character with different skills and equipment. So what's made me write a review if it seems to be like every other metroidvania game?Probably the first thing I noticed and liked is it's entertaining combat mechanics. Whenever Lily attacks, she summons the spirit of a knight, who annihilates the enemies with his weapon, which can be upgraded to increase the damage and longer combos. Keep in mind that some of them can fight indefinitely, while the others have a limited usage.Watching the spirits doing the dirty work and killing the enemies while Lily cowers in the background behind them looks incredibly endearing and is the first difference I noticed between Ender Lilies and other similar games.And of course the challenging areas, their foes and boss fights. After defeating them, Lily gains new skills, some used to access new areas, the others, usually gained from minibosses, can be used for fighting and creating your own comfortable style, ranged, magic, heavy, fast... While the beginning of the game seems rather easy, the difficulty spikes up every new area you're entering, even ending up rather tough near the end in the Verboten Domain.Clearing the map, locating all different items, discovering old diary entries and letters ended up being one of the most appealing and exciting feature of the game when you're genuinely interested in the individual tragedies of the different bosses. Sadly, the story lacks depth, so there's only a few cutscenes and the rest of the lore is stored in those letters, diaries and relic descriptions you find, so it's not much. But it still works to create a dark and impressive atmosphere you can't get enough of. The color-coded map clearly shows (from blue to gold) when you've completed a room, so you know exactly when to move on or where you have to go back to using checkpoints. Keep in mind that some items are really hard to reach (jumping puzzles), so you'll need a few tries or different skills to combine.So you either unlock new rooms to complete the map, find powerful relics to help during harder boss fights or fight some minibosses hiding within each zone to gain different attacks for every situation.While you can only equip a limited number of skills and relics, you can always change them at the checkpoints, for example, to avoid fighting poisonous or exploding enemies short range or to deal more damage on a boss mid air. I had so much fun exploring most of the areas, save for one punishing cavern near the end that contained poison fog and poisonous water, while also rather tough and powerful enemies, it was more straining than entertaining to try to discover every corner while constantly taking damage from different sources.Still a huge recommendation if you enjoyed similar games like Hollow Knight, Blasphemous or Bloodstained, Ender Lilies is even a bit easier, for those afraid of the difficulty.Short:+ playtime around 20 hours+ (for every ending)+ beautiful dark, soulslike artstyle+ amazing soundtrack for almost every area+ challenging boss fights, especially Ulv, the Mad Knight+ interesting world and map design, it's a lot of fun and rewarding to explore every corner to unlock even more powerful items+ a large variety of spirits (weapons) and relics to adapt to different situations and foes+ the unique and charming combat, using different powerful and drop-dead gorgeous designed spirits, while our controlled character hides behind them- the most important one: you won't have enough resources to upgrade all spirits, so focus on a few ones!- the soundtrack in the Verboten Domain biome- a larger number of healing usages is bound to relics and limited equipment slots, blocking a huge number of slots per item- jumping puzzles that require specific attacks unlocked, their combination and timing made some places incredibly annoying and hard to reach								",https://steamcommunity.com/app/1369630,22 February,25.7,25.7
271,76561198032500682,https://steamcommunity.com/profiles/76561198032500682/recommended/,Other,9,Recommended,91,0,"""Real darkness has love for a face. The first death is in the heart.""TLDR: There's a shortish summary at the bottom of this monstrosity. An urgent suggestion: Don't spoil yourself with videos or screenshots about this game, you'll ruin your first and inimitable playtrough and experience.Disco Elysium has such an unique and poetic way to portray the mind and life of an amnesic, alcohol addicted cop and its aftermath with so much melancholy, that it was easy to sympathize or identify yourself with the protagonist. Or at least an extraordinary introduction of a broken mind or even a bizarre political argument, especially with low rhetoric.And while playing, even as an amnesic cop, you still have to investigate to solve a case you've actually forgotten about, like everything else, your name for example, and you catch yourself wondering ""Do I even want to know what happened? Or who I really am? Oh my god, did I really do that??"". Well, here's the reason why I recommend this deeply emotional experience.Talking, walking around and inspecting things, reading a book to pass some time, put some clothes on to look like an idiot but pass an important conversation about economics, another round of talking with people, questioning, invenstigating, talking to yourself, just talking and reading for hours are your only activities in this game. This probably is a big PASS for a huge amount of gamers, because it's a different kind of role playing. You're using your skills and consciousness as your weapon, with skill checks tied to them. Suppose we don't want this to be easy. I would strongly recommend it if you're already into visual novel games, but the game tags on the store page do describe the type of gameplay and what to expect really good. Don't buy it because it's ""hyped"" and then end up writing a negative review because you ""had to read so much and nothing else"" and actually check the store page.While people do explain that this game has no combat, I want to slightly disagree regarding to the different perspective of what actually counts as combat. Because our protagonist does fight, constantly I have to emphasize, for his own identity or to restore oneself. Against or with 24 different skills, all having their own thoughts, interests and needs. Already thinking about how to satisfy them all? Have fun trying.You can spend your skill points into physique, like endurance, to have a better chance fighting against this harsh world you woke up in. Or how about a lot of points into intellect? Everyone loves and respects a rational, analytic and intelligent cop, right? Sounds like an easy job, well done.Imagine you did as I said and didn't spend any points in empathy, for example?""How long had he been there?"" Empathy: ""If you say 'two days maybe' it will be etched in her mind forever.""The dialogues adapt to the level of your skills, some conversations may turn out differently if you fail the skill checks (which are tied to the skills and can be increased while leveling up or wearing clothes with the wanted bonus) or some don't even show up. Sometimes you'll have regrets about following your highest skill, because, similar to real life, logic isn't always the best answer and you can't take your words back. Sometimes you can't even retry a failed skill check (yes I'm talking about those 97% success chances I've failed a dozen times, thank you game).So you're getting the experience to deal and fight with the protagonists consciousness and its impact on the world and people around you. As I mentioned, your consciousness, or in fact your 24 skills, have a different mind, different thoughts and different demands, all wanting to be heard and satisfied, trying to lure you from the path you may want to follow with their tempting ideas for different thoughts to research and gain new information or improve your skills. Or maybe change your personality, not always in a pleasant way or how you originally imagined.Slight conversation spoiler for an example: I had a hard time with the encyclopedia skill, because I pushed it really high and it bugged me almost constantly in every conversation with enormous text blocks or unwanted, actually unnecessary information! While this also turned the protagonist into some kind of snob, it was especially tiring to try and follow 4 single thoughts at once - while still investigating and following the main story!You: ""What's a 'contact microphone'?""Acele: ""A contact mic records sounds from inside things. Like this ice.""Encyclopedia [Easy: Success]: ""Your mangled brain would like you to know there is a boxer called Contact Mike."" You: ""What am I supposed to do with this?"" Encyclopedia: ""No idea."" You may not be responsible for the amnesic alcoholic part, that's the protagonists past, but you're jointly responsible for his actions during the story and his behavior, who do you want him to be and if you can change him, allowing you to choose what your characters ideals are, what type of cop you are, aso. Or at least wondering how you managed to unlock thoughts like Hobocop, Homosexual Underground or Cop of the Apocalypse. You are holding the key to his mind in your hands.It's like every time I'm talking to people I'm choosing Option D, 'none of the above'... Is that moralism?""Another point I'd like to address: exploration. While you're probably going to try to talk to everyone and gain as much information and context as possible, you can't do everything and there's an increased chance with every passing day to miss some people or sidequests, be it because of the lack of money, time or low skills. Like I said, it's your responsibility to try and solve everything you want, the way you'd like it to turn out. So, did I manage to persuade you? At least about the combat? I do hope this unique game gets a sequel or the developers will continue making similar games, because they have shown their huge potential and creativity level. It has become one of my favorite games of all time I enjoy coming back to and still find new bits of dialogues. We need different, unique and outstanding rpg games like Disco Elysium to break out of this ever repeating chain of copy and paste or simplyfied games, even if it's a niche product. Thanks for reading!>>>>>>>>> TLDR:""The question is, what is the question?""Pros:+ phenomenal detective story and storytelling+ absolutely amazing dialogue system+ interesting and unique characters with their own captivating stories+ entertaining sidequests, I'm so glad I didn't miss Billie Méjean+ the time mechanic and management, time passes when talking with somebody or reading a book, so you kind of have to plan your day, without pressure, who you want to talk with and what information to gain without wasting too much time, just like a real cop!+ really good voice acting, which gives some thoughts and moments an outstanding touch+ Kim Kitsuragi, just because+ and Cuno while we're at it+ different languages, this deserves his own mention, because actually being able to translate this mountain of words is admirable, I checked the german one briefly and was surprised how convincing and smooth it was+ hours and hours of reading, you're not doing much else, so if you don't like books or reading, don't buy!+ the beautiful artstyle+ Do you remember what happened when we tried to DANCE? I'm actually scared of my spinal cordCons:- sometimes you'll need a dictionary or wikipedia (I sure did) to understand the current topic, especially during political arguments. While gaining a massive amount of information about fictional wars and places, it's hard to stay focused constantly- some thoughts in the thought cabinet could use a few more hints what they're actually about and what you'll gain when researching them								",https://steamcommunity.com/app/632470,"22 October, 2021",85.1,81.6
272,76561198032500682,https://steamcommunity.com/profiles/76561198032500682/recommended/,Other,8,Not Recommended,12,6,"WARNING FOR SPOILERS! <<<<<<<<<Wtf Ubisoft. So far I enjoyed the game like I did with Origins, until the Legacy of the First Blade DLC. Again: SPOILER! DON'T READ IF YOU HAVEN'T PLAYED IT YET.Giving us players narrative choices to shape our character the way we want him/her to be and then after almost 100 hours of playtime forcing said character into a life-changing decision about sexuality (maybe some players didn't want a hetero relationship or already had someone they liked) and having a child is a serious gameplay misstep and more than just narratively dissonant. Especially when said character like my Kassandra went so gd OOC, she turned from a badass mercenary into a dull housewife, going happily to town to fetch some bread and milk for the fam. The joy. /sarcasmSettling down and starting a family is NOT everyones life goal ffs or for her to preserve the stupid bloodline, why, try her brother! Thanks for ruining my character. Don't add choices, giving me the feeling I can form a character/personality and change it in the middle of the game to a forced and not avoid- or skipable story without regard for the players choices.Oh, and one of the best parts:""I've faced walls of flame, skies black with arrows, and more beasts and blades than Herakles himself... But none match parenthood."" - Well, f*ck you too.								",https://steamcommunity.com/app/812140,"20 March, 2021",148.9,96.4
